{
  "versi": 2,
  "nama": "Angguk Santai",
  "rig": "R15",
  "durasi": 1.2,
  "fps": 30,
  "atur": { "priority": 2, "loop": true, "fps": 30, "halus": 0, "follow": 0, "napas": 0, "ayun": 0 },
  "track": {
    "UpperTorso": {
      "p": [[], [], []],
      "r": [
        [ { "t": 0, "v": 0 }, { "t": 0.3, "v": -3 }, { "t": 0.7, "v": -1.5 }, { "t": 1.2, "v": 0 } ],
        [],
        [ { "t": 0, "v": 0 }, { "t": 0.6, "v": 1 }, { "t": 1.2, "v": 0 } ]
      ]
    },
    "Head": {
      "p": [[], [], []],
      "r": [
        [ { "t": 0, "v": 0 }, { "t": 0.12, "v": 3 }, { "t": 0.42, "v": -16 }, { "t": 0.62, "v": -12 }, { "t": 0.9, "v": 2 }, { "t": 1.2, "v": 0 } ],
        [],
        []
      ]
    },
    "RightUpperArm": {
      "p": [[], [], []],
      "r": [
        [ { "t": 0, "v": 0 }, { "t": 0.5, "v": 2 }, { "t": 1.2, "v": 0 } ],
        [],
        []
      ]
    },
    "LeftUpperArm": {
      "p": [[], [], []],
      "r": [
        [ { "t": 0, "v": 0 }, { "t": 0.55, "v": 2 }, { "t": 1.2, "v": 0 } ],
        [],
        []
      ]
    }
  },
  "event": [
    { "t": 0.42, "nama": "Angguk", "nilai": "", "panjang": 0 }
  ],
  "layer": []
}
